{
  "$schema": "./execution-surface-inventory.schema.json",
  "schema_version": 1,
  "inventory_id": "ACE-EXECUTION-SURFACES",
  "summary_path": "docs/security/execution-surface-inventory.md",
  "surfaces": [
    {
      "id": "ACE-SURF-BROWSER-HOST",
      "categories": [
        "browser",
        "cdp",
        "upload",
        "download"
      ],
      "path": "desktop/src/main/browser-host.ts",
      "symbol_or_route": "BrowserHost reviewed Electron and CDP wrappers",
      "owner": "Browser Security maintainers",
      "trust_source": "Authenticated owner/task-bound Gateway commands and an isolated Electron BrowserView session",
      "final_enforcement_point": "desktop/src/main/browser-host.ts permission, navigation, download, upload, and CDP dispatch guards",
      "fail_closed_behavior": "Unknown CDP methods, missing owner or task bindings, unsafe navigation, denied permissions, and invalid artifact paths are rejected",
      "tests": [
        {
          "id": "BROWSER-HOST-BOUNDARY",
          "path": "desktop/tests/unit/browser-host.test.ts"
        }
      ],
      "evidence": [
        {
          "type": "node-test",
          "path": "desktop/tests/unit/browser-host.test.ts"
        }
      ],
      "lifecycle_revocation_owner": "BrowserManager owner/session lifecycle and Desktop BrowserHost cleanup",
      "status": "enforced",
      "artifact_refs": [
        {
          "type": "node-test",
          "path": "desktop/tests/unit/browser-host.test.ts"
        }
      ],
      "review_deadline": "2027-12-31",
      "exception_expiry": null,
      "review_trigger": "Any new Electron session hook, CDP command wrapper, upload source, download sink, or BrowserView navigation path",
      "primitive_refs": [
        {
          "path": "desktop/src/main/browser-host.ts",
          "kind": "javascript-browser",
          "primitive": "debugger.sendCommand"
        },
        {
          "path": "desktop/src/main/browser-host.ts",
          "kind": "javascript-browser",
          "primitive": "executeJavaScript"
        },
        {
          "path": "desktop/src/main/browser-host.ts",
          "kind": "javascript-browser",
          "primitive": "setPermissionCheckHandler"
        },
        {
          "path": "desktop/src/main/browser-host.ts",
          "kind": "javascript-browser",
          "primitive": "setPermissionRequestHandler"
        },
        {
          "path": "desktop/src/main/browser-host.ts",
          "kind": "javascript-browser",
          "primitive": "setWindowOpenHandler"
        },
        {
          "path": "desktop/src/main/browser-host.ts",
          "kind": "javascript-browser",
          "primitive": "will-download"
        },
        {
          "path": "desktop/src/main/browser-host.ts",
          "kind": "javascript-browser",
          "primitive": "will-navigate"
        },
        {
          "path": "desktop/src/main/browser/electron-cdp-transport.ts",
          "kind": "javascript-browser",
          "primitive": "debugger.sendCommand"
        },
        {
          "path": "desktop/src/main/host-authority-dialog.ts",
          "kind": "javascript-browser",
          "primitive": "setWindowOpenHandler"
        },
        {
          "path": "desktop/src/main/host-authority-dialog.ts",
          "kind": "javascript-browser",
          "primitive": "will-navigate"
        },
        {
          "path": "desktop/src/main/index.ts",
          "kind": "javascript-browser",
          "primitive": "setWindowOpenHandler"
        },
        {
          "path": "desktop/src/main/index.ts",
          "kind": "javascript-browser",
          "primitive": "will-navigate"
        }
      ],
      "covered_routes": []
    },
    {
      "id": "ACE-SURF-CUA-SETUP",
      "categories": [
        "cua",
        "installer",
        "download",
        "mcp"
      ],
      "path": "crew/tools/cua_setup.py",
      "symbol_or_route": "setup_cua_driver and daemon lifecycle",
      "owner": "CUA integration maintainers",
      "trust_source": "Authenticated administrator action with Desktop instance proof and pinned installer metadata",
      "final_enforcement_point": "crew/tools/cua_setup.py digest verification, restricted environment, install transaction, and daemon registry",
      "fail_closed_behavior": "Missing admin authority, unsupported platform, digest mismatch, download failure, or rollback failure leaves the CUA driver unavailable",
      "tests": [
        {
          "id": "CUA-AUTH-BOUNDARY",
          "path": "tests/gateway/test_cua_setup_authorization.py"
        },
        {
          "id": "CUA-LIFECYCLE",
          "path": "tests/test_cua_setup.py"
        }
      ],
      "evidence": [
        {
          "type": "pytest",
          "path": "tests/gateway/test_cua_setup_authorization.py"
        }
      ],
      "lifecycle_revocation_owner": "Gateway CUA setup task registry and CUA daemon lifecycle",
      "status": "host-fixed",
      "artifact_refs": [
        {
          "type": "pytest",
          "path": "tests/gateway/test_cua_setup_authorization.py"
        }
      ],
      "review_deadline": "2027-12-31",
      "exception_expiry": null,
      "review_trigger": "Installer URL, digest, daemon argv, platform launcher, MCP registration, or setup route changes",
      "primitive_refs": [],
      "covered_routes": []
    },
    {
      "id": "ACE-SURF-FILE-PYTHON-WRAPPERS",
      "categories": [
        "structured-file-read",
        "structured-file-write",
        "upload",
        "download",
        "plugin",
        "skill"
      ],
      "path": "crew/tools/file_utils.py",
      "symbol_or_route": "identity-checked Python file wrappers and exact reviewed callers",
      "owner": "File Capability maintainers",
      "trust_source": "Canonical owner/workspace capability, pinned parent identity, owned snapshots, or trusted product lifecycle input",
      "final_enforcement_point": "crew/tools/file_utils.py verified descriptor reads and pinned-parent atomic replacement, with owner-private boundaries in Browser, Plugin, and Wiki callers",
      "fail_closed_behavior": "Traversal, link or reparse objects, identity changes, oversized or special files, unauthorized roots, and failed atomic publication are rejected",
      "tests": [
        {
          "id": "FILE-POLICY",
          "path": "tests/security/test_file_policy.py"
        },
        {
          "id": "FILE-RACES",
          "path": "tests/security/test_file_races.py"
        }
      ],
      "evidence": [
        {
          "type": "pytest",
          "path": "tests/security/test_file_races.py"
        }
      ],
      "lifecycle_revocation_owner": "SecurityService capability lifecycle plus owning Browser, Plugin, Tool, or Wiki session",
      "status": "enforced",
      "artifact_refs": [
        {
          "type": "pytest",
          "path": "tests/security/test_file_races.py"
        }
      ],
      "review_deadline": "2027-12-31",
      "exception_expiry": null,
      "review_trigger": "Any new Python open/read/write primitive under crew/browser, crew/plugins, crew/tools, or crew/wiki",
      "primitive_refs": [
        {
          "path": "crew/browser/manager.py",
          "kind": "python-file",
          "primitive": "Path.open"
        },
        {
          "path": "crew/browser/manager.py",
          "kind": "python-file",
          "primitive": "os.open"
        },
        {
          "path": "crew/plugins/manager.py",
          "kind": "python-file",
          "primitive": "Path.open"
        },
        {
          "path": "crew/plugins/manager.py",
          "kind": "python-file",
          "primitive": "Path.write_text"
        },
        {
          "path": "crew/plugins/security.py",
          "kind": "python-file",
          "primitive": "Path.open"
        },
        {
          "path": "crew/plugins/security.py",
          "kind": "python-file",
          "primitive": "Path.read_bytes"
        },
        {
          "path": "crew/plugins/security.py",
          "kind": "python-file",
          "primitive": "Path.read_text"
        },
        {
          "path": "crew/tools/cua_setup.py",
          "kind": "python-file",
          "primitive": "Path.write_bytes"
        },
        {
          "path": "crew/tools/cua_setup.py",
          "kind": "python-file",
          "primitive": "Path.write_text"
        },
        {
          "path": "crew/tools/file_utils.py",
          "kind": "python-file",
          "primitive": "os.open"
        },
        {
          "path": "crew/tools/file_utils.py",
          "kind": "python-file",
          "primitive": "os.replace"
        },
        {
          "path": "crew/tools/managed_tools.py",
          "kind": "python-file",
          "primitive": "Path.open"
        },
        {
          "path": "crew/tools/pipeline.py",
          "kind": "python-file",
          "primitive": "Path.write_text"
        },
        {
          "path": "crew/tools/process_registry.py",
          "kind": "python-file",
          "primitive": "os.open"
        },
        {
          "path": "crew/wiki/archive_security.py",
          "kind": "python-file",
          "primitive": "Path.open"
        },
        {
          "path": "crew/wiki/compiler.py",
          "kind": "python-file",
          "primitive": "Path.read_text"
        },
        {
          "path": "crew/wiki/compiler.py",
          "kind": "python-file",
          "primitive": "Path.write_text"
        },
        {
          "path": "crew/wiki/manager.py",
          "kind": "python-file",
          "primitive": "Path.read_text"
        },
        {
          "path": "crew/wiki/manager.py",
          "kind": "python-file",
          "primitive": "Path.write_text"
        },
        {
          "path": "crew/wiki/parser.py",
          "kind": "python-file",
          "primitive": "Path.open"
        },
        {
          "path": "crew/wiki/prompts.py",
          "kind": "python-file",